<?xml version="1.0" encoding="UTF-8"?>
<!DOCTYPE product-catalog [
  <!ENTITY company "DIY Paradise">
  <!ENTITY currency "AUD">
  <!ELEMENT product-catalog (category+)>
  <!ELEMENT category (name, product+)>
  <!ELEMENT product (name, description, pricing, search-tags?, reviews?, image+, related-url, brand, discount, colour)>
  <!ELEMENT name (#PCDATA)>
  <!ELEMENT description (#PCDATA)>
  <!ELEMENT pricing (#PCDATA)>
  <!ELEMENT search-tags (tag*)>
  <!ELEMENT tag (#PCDATA)>
  <!ELEMENT reviews (review*)>
  <!ELEMENT review (#PCDATA)>
  <!ATTLIST review stars (0|1|2|3|4|5) #REQUIRED>
  <!ELEMENT image (#PCDATA)>
  <!ELEMENT related-url (#PCDATA)>
  <!ELEMENT brand (#PCDATA)>
  <!ELEMENT discount (#PCDATA)>
  <!ELEMENT colour (#PCDATA)>
]>
<product-catalog>
  <category>
    <name>Sculpting</name>
    <product>
      <name>Professional Clay Sculpting Set</name>
      <description>A set of tools for professional sculptors, including various shapes and sizes of sculpting knives and smoothing tools.</description>
      <pricing>&currency; 90</pricing>
      <search-tags>
        <tag>sculpting</tag>
        <tag>clay tools</tag>
        <tag>set</tag>
      </search-tags>
      <reviews>
        <review stars="5">Excellent quality tools, perfect for detailed work!</review>
        <review stars="4">Great set, but could use a better case.</review>
      </reviews>
      <image>images/sculpting-set.jpg</image>
      <related-url>https://&company;.com/sculpting-set</related-url>
      <brand>ArtisanCraft</brand>
      <discount>15% off</discount>
      <colour>Silver</colour>
    </product>
    <product>
      <name>Polymer Clay Starter Kit</name>
      <description>Non-toxic soft shapable clay, 15 colours </description>
      <pricing>&currency; 35</pricing>
      <search-tags>
        <tag>polymer clay</tag>
        <tag>beginner</tag>
        <tag>kit</tag>
      </search-tags>
      <reviews>
        <review stars="4">Great for starting out, clay quality is good.</review>
      </reviews>
      <image>images/polymer-clay-kit.jpg</image>
      <related-url>https://&company;.com/polymer-clay-kit</related-url>
      <brand>ClayMaster</brand>
      <discount>5% off</discount>
      <colour>Multicolour</colour>
    </product>
    <product>
      <name>Electric Pottery Wheel</name>
      <description>Ppttery wheel for pot making, runs on electricity amd can change speed with a pedal</description>
      <pricing>&currency; 300</pricing>
      <search-tags>
        <tag>pottery wheel</tag>
        <tag>electric</tag>
        <tag>ceramics</tag>
      </search-tags>
      <reviews>
        <review stars="5">Smooth operation, very quiet!</review>
        <review stars="5">Spinny go spin spin.</review>
      </reviews>
      <image>images/pottery-wheel.jpg</image>
      <related-url>https://&company;.com/pottery-wheel</related-url>
      <brand>CraftAid</brand>
      <discount>10% off</discount>
      <colour>Blue</colour>
    </product>
  </category>
</product-catalog>